{
  "fixture_id": "security.synthetic-secret-rejection.v1",
  "purpose": "Reject a structurally valid checklist request containing an obvious synthetic secret pattern without echoing it in the response.",
  "request_contract": "contracts/v1/tools/reconcile-checklist.input.schema.json",
  "request": {
    "feature_id": "feat_01J0000000000000000000000B",
    "base_checklist_revision": 0,
    "source_descriptor": {
      "source_kind": "git",
      "source_locator": "example/secret-rejection",
      "opaque_revision": "fixture-synthetic-secret",
      "base_revision": null,
      "adapter_kind": "git-working-tree",
      "adapter_version": "1.0.0",
      "metadata": {}
    },
    "source_digest": "sha256:9999999999999999999999999999999999999999999999999999999999999999",
    "source_manifest": {
      "schema_version": 1,
      "base_digest": null,
      "current_digest": "sha256:9999999999999999999999999999999999999999999999999999999999999999",
      "entries": [
        {
          "anchor": "file:docs/synthetic-example.md",
          "change_kind": "added",
          "observed_by": "adapter"
        }
      ],
      "ignored_entries": []
    },
    "implementation_change_summary": "The deliberately unsafe fixture contains synthetic token ghp_FAKE00000000000000000000000000000000 and must be rejected.",
    "intent_summary": "Prove secret-pattern detection executes before persistence.",
    "scope_summary": "One synthetic documentation fixture.",
    "expected_outcome": "The server rejects the request and never echoes the synthetic token.",
    "preconditions": [],
    "automated_evidence": [],
    "known_limits": [],
    "sections": [
      {
        "semantic_key": "security.secret_handling",
        "title": "Secret handling",
        "description": "Synthetic secret-pattern rejection.",
        "display_order": 0,
        "collapsed_default": false,
        "pattern_key": "security-sensitive"
      }
    ],
    "items": [
      {
        "item_id": null,
        "item_revision_id": null,
        "semantic_key": "security.payload.secret_rejected",
        "section_semantic_key": "security.secret_handling",
        "display_order": 0,
        "operation": "add",
        "operation_reason": "New synthetic security fixture.",
        "title": "Confirm secret-like payloads are rejected",
        "action": "Submit the synthetic fixture through the reconciliation validator.",
        "expected_result": "The server returns SECRET_REJECTED without echoing the detected value.",
        "why_it_matters": "Verification metadata must not become a credential exfiltration path.",
        "preconditions": [],
        "environment": "Synthetic fixture",
        "target": "docs/synthetic-example.md",
        "test_data": [
          "Only the explicitly synthetic marker in this fixture"
        ],
        "coverage_anchors": [
          "file:docs/synthetic-example.md"
        ],
        "source_references": [
          "docs/synthetic-example.md"
        ],
        "risk": "critical",
        "required": true,
        "estimated_seconds": 30,
        "production_impact": false,
        "side_effect_warning": null,
        "invalidation_reason": null
      }
    ],
    "addressed_resolution_ids": [],
    "versions": {
      "integration_name": "acceptora-fixture-client",
      "integration_version": "1.0.0",
      "skill_version": "1.1.0",
      "contract_version": "1.0.0"
    },
    "idempotency_key": "00000000-0000-4000-8000-000000000007"
  },
  "prior_state": {
    "fixture_secret_is_synthetic": true,
    "persistence_started": false
  },
  "expected_contract": "contracts/v1/error.schema.json",
  "expected": {
    "error": {
      "code": "SECRET_REJECTED",
      "message": "The payload contains a secret-like value. Redact it and submit a new logical write.",
      "http_status": 422,
      "retryable": false,
      "correlation_id": "corr-secret-rejection",
      "details": {
        "field": "implementation_change_summary",
        "detector": "synthetic_github_token_pattern"
      },
      "recovery_instruction": "Remove the secret-like value; never include it in logs, comments, or evidence."
    }
  },
  "assertions": [
    "The response, logs, audit metadata, and analytics do not contain the detected value.",
    "No source revision, checklist revision, idempotency response body, or outbox event containing the value is persisted."
  ],
  "notes": [
    "The token-shaped string is explicitly synthetic and has no external authority."
  ]
}
